<?xml version="1.0" encoding="UTF-8" ?>
<xsd:schema xmlns:xsd="http://www.w3.org/2001/XMLSchema">
    <xsd:element name="Cards">
        <xsd:complexType>
            <xsd:sequence>
                <xsd:element name="Card" type="Card" maxOccurs="unbounded"/>
            </xsd:sequence>
        </xsd:complexType>
    </xsd:element>
    <xsd:complexType name="Card">
        <xsd:sequence>
            <xsd:element name="Thema" type="xsd:string" maxOccurs="unbounded"/>
            <xsd:element name="Type" type="xsd:string" maxOccurs="unbounded"/>
            <xsd:element name="Country" type="Country" maxOccurs="1"/>
            <xsd:element name="Year" type="xsd:gYear" maxOccurs="1"/>
            <xsd:element name="Author" type="Author" maxOccurs="unbounded"/>
            <xsd:element name="Valuable" maxOccurs="1"/>
        </xsd:sequence>
        <xsd:attribute name="id" type="xsd:int" use="required"/>
    </xsd:complexType>
    <xsd:simpleType name="Country">
        <xsd:restriction>
            <xsd:enumeration value="Belarus"/>
            <xsd:enumeration value="USA"/>
            <xsd:enumeration value="Russia"/>
            <xsd:enumeration value="UK"/>
        </xsd:restriction>
    </xsd:simpleType>
    <xsd:complexType name="Author">
        <xsd:sequence>
            <xsd:element name="FirstName" type="xsd:string"/>
            <xsd:element name="LastName" type="xsd:string"/>
        </xsd:sequence>
    </xsd:complexType>
</xsd:schema>