<?xml version="1.0" encoding="UTF-8" ?>
<Cards xmlns:xsd="http://www.w3.org/2001/XMLSchema-instance" xsd:noNamespaceSchemaLocation="cards.xsd">
    <Card id="1">
        <Thema>CityScape</Thema>
        <Type>Congratulatory</Type>
        <Country>Belarus</Country>
        <Year>2023</Year>
        <Author>
            <FirstName>Ivan</FirstName>
            <LastName>Petrov</LastName>
        </Author>
        <Valuable>Thematic</Valuable>
    </Card>
    <Card id="2">
        <Thema>Nature</Thema>
        <Type>Congratulatory</Type>
        <Country>USA</Country>
        <Year>2023</Year>
        <Author>
            <FirstName>Oliver</FirstName>
            <LastName>Singer</LastName>
        </Author>
        <Valuable>Historical</Valuable>
    </Card>
</Cards>